<?xml version="1.0" encoding="utf-8"?>
<xs:schema xmlns="http://tempuri.org/rutas" elementFormDefault="qualified" targetNamespace="http://tempuri.org/rutas" xmlns:xs="http://www.w3.org/2001/XMLSchema">
	<xs:element name="rutas">
		<xs:complexType>
			<xs:sequence>
				<xs:element minOccurs="0" maxOccurs="unbounded" ref="ruta" />
			</xs:sequence>
		</xs:complexType>
	</xs:element>
	<xs:element name="ruta">
		<xs:complexType>
			<xs:sequence>
				<xs:element ref="tipoRuta" />
				<xs:element ref="medioTransporte" />
				<xs:element ref="fechaInicio" />
				<xs:element ref="horaInicio" />
				<xs:element ref="personasAdecuadas" />
				<xs:element ref="coordenadasInicio" />
				<xs:element ref="referencias" />
				<xs:element ref="hitos" />
				<xs:element ref="recomendacion" />
			</xs:sequence>
			<xs:attribute name="lugarInicio" type="xs:string" use="required" />
			<xs:attribute name="direccionInicio" type="xs:string" use="required" />
			<xs:attribute name="descripcion" type="xs:string" use="required" />
			<xs:attribute name="agencia" type="xs:string" use="required" />
			<xs:attribute name="duracion" type="xs:duration" use="required" />
		</xs:complexType>
	</xs:element>
	<xs:element name="hito">
		<xs:complexType>
			<xs:sequence>
				<xs:element ref="coordenadas" />
				<xs:element ref="distanciaAnterior" />
				<xs:element ref="fotoHitos" />
				<xs:element ref="videosHito" />
			</xs:sequence>
			<xs:attribute name="nombre" type="xs:string" use="required" />
			<xs:attribute name="descripcion" type="xs:string" use="required" />
		</xs:complexType>
	</xs:element>
	<xs:element name="tipoRuta" type="xs:string" />
	<xs:element name="medioTransporte" type="xs:string" />
	<xs:element name="fechaInicio" type="xs:date" />
	<xs:element name="horaInicio" type="xs:time" />
	<xs:element name="duracion" type="xs:duration" />
	<xs:element name="agencia" type="xs:string" />
	<xs:element name="recomendacion">
		<xs:simpleType>
			<xs:restriction base="xs:nonNegativeInteger">
				<xs:minInclusive value="0" />
				<xs:maxInclusive value="10" />
			</xs:restriction>
		</xs:simpleType>
	</xs:element>
	<xs:element name="personasAdecuadas" type="xs:string" />
	<xs:element name="lugarInicio" type="xs:string" />
	<xs:element name="direccionInicio" type="xs:string" />
	<xs:element name="coordenadasInicio" type="xs:string" />
	<xs:element name="referencias">
		<xs:complexType>
			<xs:sequence>
				<xs:element minOccurs="3" maxOccurs="unbounded" ref="referencia" />
			</xs:sequence>
		</xs:complexType>
	</xs:element>
	<xs:element name="referencia" type="xs:string" />
	<xs:element name="hitos">
		<xs:complexType>
			<xs:sequence>
				<xs:element minOccurs="1" maxOccurs="unbounded" ref="hito" />
			</xs:sequence>
		</xs:complexType>
	</xs:element>
	<xs:element name="nombre" type="xs:string" />
	<xs:element name="descripcion" type="xs:string" />
	<xs:element name="coordenadas">
		<xs:complexType>
			<xs:sequence>
				<xs:element name="longitud" type="xs:float"/>
				<xs:element name="latitud" type="xs:float"/>
				<xs:element name="altitud" type="xs:float"/>
			</xs:sequence>
		</xs:complexType>

	</xs:element>
	<xs:element name="distanciaAnterior" type="xs:string" />
	<xs:element name="fotoHitos">
		<xs:complexType>
			<xs:sequence>
				<xs:element minOccurs="1" maxOccurs="5" ref="fotoHito" />
			</xs:sequence>
		</xs:complexType>
	</xs:element>
	<xs:element name="fotoHito" type="xs:string" />
	<xs:element name="videosHito">
		<xs:complexType>
			<xs:sequence>
				<xs:element minOccurs="0" maxOccurs="3" ref="videoHito" />
			</xs:sequence>
		</xs:complexType>
	</xs:element>
	<xs:element name="videoHito" type="xs:string" />
</xs:schema>